{
  "@context": [
    "https://www.w3.org/ns/credentials/v2",
    "https://agentreceipts.ai/context/v1"
  ],
  "id": "urn:receipt:a1b2c3d4-e5f6-47a8-b9c0-d1e2f3a4b501",
  "type": ["VerifiableCredential", "AgentReceipt"],
  "version": "0.1.0",
  "issuer": {
    "id": "did:agent:file-manager-agent-001",
    "type": "AIAgent",
    "name": "File Manager"
  },
  "validFrom": "2026-03-31T10:00:00Z",
  "credentialSubject": {
    "principal": {
      "id": "did:user:bob"
    },
    "action": {
      "id": "act_a33dca52-2d86-4ebb-8401-d345dc0e364c",
      "type": "filesystem.file.read",
      "risk_level": "low",
      "target": {
        "system": "local",
        "resource": "/home/bob/reports/q3.csv"
      },
      "timestamp": "2026-03-31T10:00:00Z"
    },
    "outcome": {
      "status": "success"
    },
    "chain": {
      "sequence": 1,
      "previous_receipt_hash": null,
      "chain_id": "chain_file_cleanup_001"
    }
  },
  "proof": {
    "type": "Ed25519Signature2020",
    "created": "2026-03-31T10:00:01Z",
    "verificationMethod": "did:agent:file-manager-agent-001#key-1",
    "proofPurpose": "assertionMethod",
    "proofValue": "z2WjXcKNmNqR8sTuVwXyZaBcDeFgHJkNmNaPqRsTuVwXyZaBcDeFgHJkNmNaPqRsTuVwXyZaBcDeFgHJkNmNa"
  }
}
