{
  "@context": [
    "https://www.w3.org/ns/credentials/v2",
    "https://agentreceipts.ai/context/v1"
  ],
  "id": "urn:receipt:a1b2c3d4-e5f6-47a8-b9c0-d1e2f3a4b502",
  "type": ["VerifiableCredential", "AgentReceipt"],
  "version": "0.1.0",
  "issuer": {
    "id": "did:agent:file-manager-agent-001",
    "type": "AIAgent",
    "name": "File Manager"
  },
  "validFrom": "2026-03-31T10:01:00Z",
  "credentialSubject": {
    "principal": {
      "id": "did:user:bob"
    },
    "action": {
      "id": "act_01da5d9c-04f4-4fde-9767-436df57cf04f",
      "type": "filesystem.file.modify",
      "risk_level": "medium",
      "target": {
        "system": "local",
        "resource": "/home/bob/reports/q3.csv"
      },
      "parameters_hash": "sha256:1a2b3c4d5e6f7a8b9c0d1e2f3a4b5c6d7e8f9a0b1c2d3e4f5a6b7c8d9e0f1a2b",
      "timestamp": "2026-03-31T10:01:00Z"
    },
    "outcome": {
      "status": "success",
      "reversible": true,
      "state_change": {
        "before_hash": "sha256:aaaaaaaaaaaaaaaaaaaaaaaaaaaaaaaaaaaaaaaaaaaaaaaaaaaaaaaaaaaaaaaa",
        "after_hash": "sha256:bbbbbbbbbbbbbbbbbbbbbbbbbbbbbbbbbbbbbbbbbbbbbbbbbbbbbbbbbbbbbbbb"
      }
    },
    "chain": {
      "sequence": 2,
      "previous_receipt_hash": "sha256:c3d4e5f6a7b8c9d0e1f2a3b4c5d6e7f8a9b0c1d2e3f4a5b6c7d8e9f0a1b2c3d4",
      "chain_id": "chain_file_cleanup_001"
    }
  },
  "proof": {
    "type": "Ed25519Signature2020",
    "created": "2026-03-31T10:01:01Z",
    "verificationMethod": "did:agent:file-manager-agent-001#key-1",
    "proofPurpose": "assertionMethod",
    "proofValue": "z3XkYmMnApQrStUvWxYzAbCdEfGhJjKmMnApQrStUvWxYzAbCdEfGhJjKmMnApQrStUvWxYzAbCdEfGhJjKmMnAp"
  }
}
